claim,answer,reason,source_ticket,allowed_grant_language,forbidden_grant_language
Buchdahl safety implies no horizon,PARTIAL_YES,Buchdahl bound r_s/R < 8/9 ensures finite central pressure for static fluid sphere; r_s/R < 1 separately ensures no horizon; T224 ladder satisfies both,"T220, T221, T222, Arrechea 2024",the geometric configuration is Buchdahl-safe (r_s/R = 0.40 < 8/9) and has no horizon,Buchdahl-safe geometry implies a buildable warp drive
Buchdahl safety implies material feasibility,NO,"Buchdahl bound assumes isotropy, outwardly-decreasing density, regular central pressure, valid EOS and dynamical stability; each is an INDEPENDENT gate","T222, T224, Arrechea 2024",Buchdahl-safe geometry is necessary but not sufficient for material feasibility,Buchdahl-safe means material feasible
WarpFactory verifyTensor validates metric consistency,YES,verifyTensor is the WarpFactory routine that checks Einstein-tensor / energy-tensor consistency at a numerical grid,"T220, T224 sanity rerun","WarpFactory verifyTensor validates the geometric metric consistency for the chosen (M, R) profile",WarpFactory verifyTensor proves anything beyond geometric consistency
WarpFactory verifyTensor validates C,NO,"WarpFactory has no representation of (Q, K, W) audit-chain operator; C is set in T210 / T212 / T214 / T215","T220, T221, T222, T224",WarpFactory verifyTensor does not validate the audit-chain response coefficient C,WarpFactory PASS implies C is correct
WarpFactory verifyTensor validates material realisation,NO,"WarpFactory does not import P(rho), causality, dP/drho stability, or any matter-side ledger","T220, T222, T224",WarpFactory verifyTensor does not validate material realisation,WarpFactory PASS implies the source matter is buildable
WarpFactory verifyTensor validates EOS support,NO,"verifyTensor is a geometric / Einstein-tensor consistency check, not a TOV gate","T220, T222, T224",WarpFactory verifyTensor does not address EOS support,WarpFactory PASS implies EOS support
